{
  "$schema": "http://json-schema.org/draft-07/schema#",
  "title": "Artistic Style Specification",
  "description": "A schema for formally defining the characteristics of a visual artistic style.",
  "type": "object",
  "properties": {
    "style_name": {
      "description": "The unique name identifying the artistic style.",
      "type": "string"
    },
    "description": {
      "description": "A brief description of the artistic style and its purpose.",
      "type": "string"
    },
    "overall_aesthetic": {
      "description": "Describes the general look and feel of the style.",
      "type": "object",
      "properties": {
        "summary": {
          "description": "A concise summary of the style's core aesthetic characteristics.",
          "type": "string"
        },
        "impression": {
          "description": "The overall feeling or message conveyed by the style.",
          "type": "string"
        }
      },
      "required": ["summary", "impression"],
      "additionalProperties": false
    },
    "visual_elements": {
      "description": "Detailed breakdown of the core visual components and techniques.",
      "type": "object",
      "properties": {
        "perspective": {
          "description": "Specification for the perspective or projection used.",
          "type": "object",
          "properties": {
            "type": {
              "description": "The primary type of perspective (e.g., Isometric, Linear, Atmospheric).",
              "type": "string"
            },
            "details": {
              "description": "Specific details about the perspective implementation.",
              "type": "string"
            },
            "effect": {
              "description": "The intended visual or conceptual effect of the chosen perspective.",
              "type": "string"
            }
          },
          "required": ["type", "details", "effect"],
          "additionalProperties": false
        },
        "dimensionality": {
          "description": "How dimensionality (2D/3D) is represented.",
          "type": "object",
          "properties": {
            "representation": {
              "description": "How forms are depicted (e.g., '3D forms rendered using 2D line art').",
              "type": "string"
            },
            "technique": {
              "description": "Specific techniques used to convey depth or volume.",
              "type": "string"
            },
            "clarity": {
              "description": "How clarity of form and structure is maintained.",
              "type": "string"
            }
          },
          "required": ["representation", "technique", "clarity"],
          "additionalProperties": false
        },
        "line_art": {
          "description": "Specifications for the use of lines.",
          "type": "object",
          "properties": {
            "quality": {
              "description": "The characteristic quality of the lines (e.g., Crisp, Sketchy, Rough).",
              "type": "string"
            },
            "weight": {
              "description": "Details about line weight/thickness and its variation.",
              "type": "string"
            },
            "style": {
              "description": "The style of lines used (e.g., Solid, Dashed, Dotted, Stylized).",
              "type": "string"
            },
            "continuity": {
              "description": "Whether lines are typically continuous or broken.",
              "type": "string"
            }
          },
          "required": ["quality", "weight", "style", "continuity"],
          "additionalProperties": false
        },
        "color_palette": {
          "description": "Specifications for the color scheme.",
          "type": "object",
          "properties": {
            "scheme": {
              "description": "The overall color approach (e.g., Monochrome, Analogous, Complementary, Custom).",
              "type": "string"
            },
            "variants": {
              "description": "Specific examples or descriptions of allowed color combinations.",
              "type": "array",
              "items": {
                "type": "string"
              },
              "minItems": 1
            },
            "contrast": {
              "description": "The typical level of contrast within the palette.",
              "type": "string"
            }
          },
          "required": ["scheme", "variants", "contrast"],
          "additionalProperties": false
        },
        "shading_and_texture": {
          "description": "How shading, gradients, and surface textures are handled.",
          "type": "object",
          "properties": {
            "shading": {
              "description": "Presence and style of shading (e.g., Absent, Cel-shading, Smooth Gradients).",
              "type": "string"
            },
            "texture": {
              "description": "Presence and style of surface textures (e.g., None, Subtle Noise, Material-specific).",
              "type": "string"
            },
            "exceptions": {
              "description": "Any permitted exceptions or specific techniques (e.g., Minimal hatching).",
              "type": "string"
            }
          },
          "required": ["shading", "texture", "exceptions"],
          "additionalProperties": false
        },
        "composition": {
          "description": "Principles guiding the arrangement of elements.",
          "type": "object",
          "properties": {
            "arrangement": {
              "description": "Common layout patterns or structures.",
              "type": "string"
            },
            "spacing": {
              "description": "How space is used between elements.",
              "type": "string"
            },
            "negative_space": {
              "description": "The role and treatment of negative space.",
              "type": "string"
            },
            "balance": {
              "description": "The typical approach to compositional balance (e.g., Symmetrical, Asymmetrical, Radial).",
              "type": "string"
            }
          },
          "required": ["arrangement", "spacing", "negative_space", "balance"],
          "additionalProperties": false
        },
        "geometry_and_form": {
          "description": "How geometric shapes and forms are treated.",
          "type": "object",
          "properties": {
            "simplification": {
              "description": "The degree to which forms are simplified or abstracted.",
              "type": "string"
            },
            "edges_and_corners": {
              "description": "The characteristic treatment of edges and corners (e.g., Sharp, Rounded, Beveled).",
              "type": "string"
            },
            "consistency": {
              "description": "Requirements for consistency in geometric treatment.",
              "type": "string"
            }
          },
          "required": ["simplification", "edges_and_corners", "consistency"],
          "additionalProperties": false
        },
        "detail_level": {
          "description": "The overall level of detail.",
          "type": "object",
          "properties": {
            "level": {
              "description": "General level of detail (e.g., Minimalist, Moderate, Photorealistic).",
              "type": "string"
            },
            "focus": {
              "description": "What aspects are emphasized (e.g., Overall shape, Surface texture, Internal mechanics).",
              "type": "string"
            },
            "symbolism": {
              "description": "How symbols or iconic elements are integrated, if applicable.",
              "type": "string"
            }
          },
          "required": ["level", "focus", "symbolism"],
          "additionalProperties": false
        }
      },
      "required": [
        "perspective",
        "dimensionality",
        "line_art",
        "color_palette",
        "shading_and_texture",
        "composition",
        "geometry_and_form",
        "detail_level"
      ],
       "additionalProperties": false
    },
    "intended_feel": {
      "description": "Keywords describing the emotional or intellectual response the style aims to evoke.",
      "type": "array",
      "items": {
        "type": "string"
      },
      "minItems": 1
    },
    "potential_use_cases": {
      "description": "Examples of where this style might be effectively applied.",
      "type": "array",
      "items": {
        "type": "string"
      },
      "minItems": 1
    }
  },
  "required": [
    "style_name",
    "description",
    "overall_aesthetic",
    "visual_elements",
    "intended_feel",
    "potential_use_cases"
  ],
  "additionalProperties": false
}